korean,correct,correctkorean,question,solution,wrong
"어떻게 해야 할지 물어볼 때","What do you think I should do?","제가 어떻게 해야 할까요?","What do you think I should (____)?","do","go"
"내일 날씨가 어떤지 물어볼 때","What do you think the weather will be like tomorrow?","내일 날씨가 어떨 것 같나요?","What do you think the weather will (____) like tomorrow?","be","look"
"어떻게 도와줄 수 있는지 물어볼 때","What can I do to help you?","어떻게 도와드릴 수 있을까요?","What can I (____) to help you?","do","say"
"무엇을 주문해야 할지 물어볼 때","What should I order for dinner?","저녁으로 무엇을 주문해야 할까요?","What should I (____) for dinner?","order","skip"
"내일 할 일이 무엇인지 물어볼 때","What do you have planned for tomorrow?","내일 무슨 계획이 있나요?","What do you (____) planned for tomorrow?","have","avoid"
"어떤 음악을 들을지 물어볼 때","What kind of music do you like?","어떤 음악을 좋아하시나요?","What kind of music do you (____)?","like","dislike"
"어떤 책을 읽어야 할지 물어볼 때","What book should I read next?","다음에는 어떤 책을 읽어야 할까요?","What book should I (____) next?","read","write"
"어디로 가야 할지 물어볼 때","Where should I go for vacation?","휴가로 어디에 가야 할까요?","Where should I (____) for vacation?","go","stay"
"언제 시작해야 할지 물어볼 때","When should I start the project?","언제 프로젝트를 시작해야 하나요?","When should I (____) the project?","start","end"
"누구에게 물어봐야 할지 물어볼 때","Who should I ask for advice?","누구에게 조언을 구해야 하나요?","Who should I (____) for advice?","ask","tell"
"무엇을 기대해야 할지 물어볼 때","What should I expect at the meeting?","회의에서 무엇을 기대해야 하나요?","What should I (____) at the meeting?","expect","ignore"
"어떻게 준비해야 할지 물어볼 때","How should I prepare for the interview?","면접을 어떻게 준비해야 하나요?","How should I (____) for the interview?","prepare","forget"
"어떤 운동을 해야 할지 물어볼 때","What exercise should I do to stay fit?","건강을 유지하려면 어떤 운동을 해야 하나요?","What exercise should I (____) to stay fit?","do","avoid"
"어떻게 하면 더 잘할 수 있을지 물어볼 때","How can I improve my skills?","어떻게 하면 기술을 향상시킬 수 있을까요?","How can I (____) my skills?","improve","neglect"
"어떤 색이 어울릴지 물어볼 때","What color do you think suits me best?","어떤 색이 저에게 가장 잘 어울릴까요?","What color do you think (____) me best?","suits","fades"
"무엇을 먹을지 물어볼 때","What should I eat for breakfast?","아침으로 무엇을 먹어야 할까요?","What should I (____) for breakfast?","eat","drink"
"무엇을 기대해야 할지 물어볼 때","What do you expect from this project?","이 프로젝트에서 무엇을 기대하나요?","What do you (____) from this project?","expect","ignore"
"어떻게 시작해야 할지 물어볼 때","How should I start learning a new language?","새 언어를 어떻게 시작해야 하나요?","How should I (____) learning a new language?","start","stop"
"어떤 영화가 좋은지 물어볼 때","What movie do you recommend watching?","어떤 영화를 추천하시나요?","What movie do you (____) watching?","recommend","avoid"
"어떻게 친구를 사귈지 물어볼 때","How can I make new friends?","어떻게 새로운 친구를 사귈 수 있을까요?","How can I (____) new friends?","make","lose"
"어디에서 점심을 먹을지 물어볼 때","Where do you suggest I have lunch?","점심을 어디에서 먹는 것이 좋을까요?","Where do you (____) I have lunch?","suggest","avoid"
"무엇을 배우고 싶은지 물어볼 때","What do you want to learn next?","다음에 무엇을 배우고 싶나요?","What do you (____) to learn next?","want","ignore"
"어떤 차를 살지 물어볼 때","What car should I buy?","어떤 차를 사야 할까요?","What car should I (____)?","buy","rent"
"어떤 TV 쇼를 볼지 물어볼 때","What TV show do you recommend?","어떤 TV 쇼를 추천하시나요?","What TV show do you (____)?","recommend","skip"
"어떻게 스트레스를 줄일지 물어볼 때","How can I reduce stress?","어떻게 스트레스를 줄일 수 있을까요?","How can I (____) stress?","reduce","increase"
"어디서 물건을 살지 물어볼 때","Where should I buy groceries?","식료품을 어디서 사야 하나요?","Where should I (____) groceries?","buy","steal"
"어떻게 일을 처리할지 물어볼 때","How do you handle stress?","스트레스를 어떻게 관리하시나요?","How do you (____) stress?","handle","ignore"
"어떻게 돈을 절약할지 물어볼 때","How can I save money?","어떻게 돈을 절약할 수 있을까요?","How can I (____) money?","save","spend"
"어디서 운동할지 물어볼 때","Where do you recommend exercising?","어디서 운동하는 것이 좋을까요?","Where do you (____) exercising?","recommend","forbid"
"어떤 기술을 배울지 물어볼 때","What skills should I develop?","어떤 기술을 개발해야 하나요?","What skills should I (____)?","develop","ignore"
"어떻게 체력을 유지할지 물어볼 때","How can I maintain my fitness?","어떻게 체력을 유지할 수 있을까요?","How can I (____) my fitness?","maintain","ignore"
"어디서 공부할지 물어볼 때","Where should I study for exams?","시험 공부를 어디서 해야 하나요?","Where should I (____) for exams?","study","party"
"어떤 운동이 좋은지 물어볼 때","What exercise do you recommend for strength?","힘을 기르기 위해 어떤 운동을 추천하시나요?","What exercise do you (____) for strength?","recommend","avoid"
"어떻게 일을 효율적으로 할지 물어볼 때","How can I work more efficiently?","어떻게 일을 더 효율적으로 할 수 있을까요?","How can I (____) more efficiently?","work","procrastinate"
"어떤 책을 읽을지 물어볼 때","What book do you think I should read?","어떤 책을 읽어야 할까요?","What book do you think I should (____)?","read","avoid"
"어떻게 다이어트를 시작할지 물어볼 때","How should I start a diet?","다이어트를 어떻게 시작해야 하나요?","How should I (____) a diet?","start","end"
"어떻게 여가 시간을 보낼지 물어볼 때","What should I do in my free time?","여가 시간에 무엇을 해야 할까요?","What should I (____) in my free time?","do","waste"
"어떻게 목표를 이룰지 물어볼 때","How can I achieve my goals?","어떻게 목표를 이룰 수 있을까요?","How can I (____) my goals?","achieve","ignore"
"어떻게 건강을 유지할지 물어볼 때","What do you do to stay healthy?","건강을 유지하기 위해 무엇을 하시나요?","What do you (____) to stay healthy?","do","ignore"
"어떤 곳이 여행하기 좋은지 물어볼 때","Where do you recommend visiting?","어디를 방문하는 것을 추천하시나요?","Where do you (____) visiting?","recommend","avoid"
"어떤 차를 선택할지 물어볼 때","What car do you suggest for a family?","가족을 위해 어떤 차를 추천하시나요?","What car do you (____) for a family?","suggest","avoid"
"어떻게 시간을 관리할지 물어볼 때","How do you manage your time effectively?","시간을 어떻게 효과적으로 관리하시나요?","How do you (____) your time effectively?","manage","waste"
